{
  "entityType": "product",
  "id": "weyerhaeuser.timberstrand-lsl",
  "manufacturerId": "weyerhaeuser",
  "brandId": "trus-joist",
  "categoryIds": [
    "engineered-timber"
  ],
  "sourceRefs": [
    "weyerhaeuser.engineered-wood.page-20261021",
    "weyerhaeuser.design-values.page-20261021"
  ],
  "verification": {
    "status": "discovered"
  }
}
